{
  "schema_version": "1.3",
  "index_type": "study_content_catalog",
  "collection_title": "Generated Study Notes",
  "collection_slug": "generated-study-notes",
  "description": "Website-ready index of generated pathology study assets. Completed chapters contain third-party generated study notes, exam-prep questions with keyed answers and brief source-grounded rationales, and flashcards for spaced-repetition revision. Later chapters can be added to this same index as new assets are created, including additional flashcard resources.",
  "supported_asset_types": [
    "study_notes_markdown",
    "exam_prep_questions_json",
    "flashcards_json"
  ],
  "disclaimer": {
    "summary": "Third-party generated study materials.",
    "endorsement_notice": "The notes, questions, and flashcards listed in this index are third-party generated study aids. They are not produced by, reviewed by, approved by, endorsed by, or affiliated with the textbook authors, Elsevier, the Royal College of Pathologists of Australasia, or any other authority, institution, publisher, or examining body.",
    "use_note": "Use these materials as revision support alongside the original source material."
  },
  "content_status": {
    "chapter_count_total": 25,
    "chapter_count_complete": 13,
    "chapter_count_planned": 12
  },
  "source_registry": [
    {
      "source_id": "robbins-basic-pathology-10e",
      "source_type": "textbook",
      "source_title": "Robbins Basic Pathology, 10th Edition",
      "publisher": "Elsevier"
    },
    {
      "source_id": "robbins-cotran-pathologic-basis-of-disease-10e",
      "source_type": "textbook_reference_cited_by_syllabus",
      "source_title": "Robbins and Cotran Pathologic Basis of Disease",
      "editors": ["Vinay Kumar", "Abul K. Abbas", "Jon C. Aster"],
      "edition": "10th Edition",
      "publication_year": 2020,
      "publisher": "Elsevier"
    },
    {
      "source_id": "rcpa-bps-syllabus-2026-oct-2025",
      "source_type": "course_syllabus",
      "source_title": "RCPA - Basic Pathological Sciences Syllabus 2026 - October 2025",
      "organization": "Royal College of Pathologists of Australasia"
    },
    {
      "source_id": "bps-2026-mock-exam-question-set",
      "source_type": "mock_exam_style_reference",
      "source_title": "BPS 2026 Mock Exam Question Set",
      "organization": "Royal College of Pathologists of Australasia"
    },
    {
      "source_id": "rcpa-bps-exam-2021-ocr",
      "source_type": "past_exam_paper_ocr_extract",
      "source_title": "RCPA Basic Pathological Sciences Exam 2021 (OCR Extract)",
      "organization": "Royal College of Pathologists of Australasia"
    }
  ],
  "chapters": [
    {
      "chapter_number": 1,
      "chapter_code": "01",
      "title": "The Cell as a Unit of Health and Disease",
      "slug": "01-the-cell-as-a-unit-of-health-and-disease",
      "status": "complete",
      "website": {
        "nav_label": "Chapter 1",
        "card_title": "The Cell as a Unit of Health and Disease",
        "card_description": "Genome, epigenome, cellular housekeeping, signaling, extracellular matrix, cell cycle, and stem cells."
      },
      "description": "Third-party generated Chapter 1 revision assets based primarily on Robbins Basic Pathology, 10th Edition, Chapter 1, with RCPA syllabus framing and mock-exam style alignment.",
      "topics": [
        "Genome and epigenome",
        "Noncoding DNA",
        "Histone organization",
        "Micro-RNA and long noncoding RNA",
        "Cellular housekeeping",
        "Plasma membrane and transport",
        "Cytoskeleton and cell junctions",
        "ER, Golgi, lysosomes, and proteasomes",
        "Mitochondrial function",
        "Cell signaling and growth factors",
        "Extracellular matrix",
        "Cell cycle",
        "Stem cells and regenerative medicine"
      ],
      "sources_used": [
        "robbins-basic-pathology-10e",
        "robbins-cotran-pathologic-basis-of-disease-10e",
        "rcpa-bps-syllabus-2026-oct-2025",
        "bps-2026-mock-exam-question-set"
      ],
      "recommended_asset_types": [
        "study_notes_markdown",
        "exam_prep_questions_json",
        "flashcards_json"
      ],
      "assets": [
        {
          "asset_type": "study_notes_markdown",
          "title": "01 - The Cell as a Unit of Health and Disease - Study Notes",
          "path": "Generated Study Notes/01 - The Cell as a Unit of Health and Disease - Study Notes.md",
          "status": "complete"
        },
        {
          "asset_type": "exam_prep_questions_json",
          "title": "01 - The Cell as a Unit of Health and Disease - Exam Prep Questions",
          "path": "Generated Study Notes/01 - The Cell as a Unit of Health and Disease - Exam Prep Questions.json",
          "status": "complete",
          "question_count": 30,
          "answer_key_included": true,
          "description": "Single-choice JSON question set with keyed choices, keyed answers, and brief source-grounded rationales.",
          "answer_key_format": "correct_choice_key_with_reason",
          "choice_key_format": "uppercase_letters",
          "choice_order_randomizable": true,
          "page_reference_style": "printed_book_page_numbers"
        },
        {
          "asset_type": "flashcards_json",
          "title": "01 - The Cell as a Unit of Health and Disease - Flashcards",
          "path": "Generated Study Notes/01 - The Cell as a Unit of Health and Disease - Flashcards.json",
          "status": "complete",
          "description": "Structured Chapter 1 flashcard deck with bucket metadata, tags, and printed-page references for app ingestion.",
          "card_count": 54,
          "deck_name": "Pathology::Chapter 01 - The Cell as a Unit of Health and Disease",
          "flashcard_format": "basic",
          "tags": [
            "pathology",
            "chapter-01",
            "active-recall",
            "spaced-repetition"
          ]
        }
      ]
    },
    {
      "chapter_number": 2,
      "chapter_code": "02",
      "title": "Cell Injury, Cell Death, and Adaptations",
      "slug": "02-cell-injury-cell-death-and-adaptations",
      "status": "complete",
      "website": {
        "nav_label": "Chapter 2",
        "card_title": "Cell Injury, Cell Death, and Adaptations",
        "card_description": "Stress responses, reversible and irreversible injury, cell death pathways, adaptations, accumulations, calcification, and aging."
      },
      "description": "Third-party generated Chapter 2 revision assets based primarily on Robbins Basic Pathology, 10th Edition, Chapter 2, with RCPA syllabus framing and mock-exam style alignment.",
      "topics": [
        "Etiology and pathogenesis",
        "Adaptation and homeostasis",
        "Causes of cell injury",
        "Reversible cell injury",
        "Necrosis",
        "Apoptosis",
        "Necroptosis, pyroptosis, and autophagy",
        "Hypoxia and ischemia",
        "Ischemia-reperfusion injury and oxidative stress",
        "Toxic injury and ER stress",
        "Hypertrophy, hyperplasia, atrophy, and metaplasia",
        "Intracellular accumulations",
        "Pathologic calcification",
        "Cellular aging"
      ],
      "sources_used": [
        "robbins-basic-pathology-10e",
        "robbins-cotran-pathologic-basis-of-disease-10e",
        "rcpa-bps-syllabus-2026-oct-2025",
        "bps-2026-mock-exam-question-set"
      ],
      "recommended_asset_types": [
        "study_notes_markdown",
        "exam_prep_questions_json",
        "flashcards_json"
      ],
      "assets": [
        {
          "asset_type": "study_notes_markdown",
          "title": "02 - Cell Injury, Cell Death, and Adaptations - Study Notes",
          "path": "Generated Study Notes/02 - Cell Injury, Cell Death, and Adaptations - Study Notes.md",
          "status": "complete"
        },
        {
          "asset_type": "exam_prep_questions_json",
          "title": "02 - Cell Injury, Cell Death, and Adaptations - Exam Prep Questions",
          "path": "Generated Study Notes/02 - Cell Injury, Cell Death, and Adaptations - Exam Prep Questions.json",
          "status": "complete",
          "question_count": 30,
          "answer_key_included": true,
          "description": "Single-choice JSON question set with keyed choices, keyed answers, and brief source-grounded rationales.",
          "answer_key_format": "correct_choice_key_with_reason",
          "choice_key_format": "uppercase_letters",
          "choice_order_randomizable": true,
          "page_reference_style": "printed_book_page_numbers"
        },
        {
          "asset_type": "flashcards_json",
          "title": "02 - Cell Injury, Cell Death, and Adaptations - Flashcards",
          "path": "Generated Study Notes/02 - Cell Injury, Cell Death, and Adaptations - Flashcards.json",
          "status": "complete",
          "description": "Structured Chapter 2 flashcard deck with bucket metadata, tags, and printed-page references for app ingestion.",
          "card_count": 56,
          "deck_name": "Pathology::Chapter 02 - Cell Injury, Cell Death, and Adaptations",
          "flashcard_format": "basic",
          "tags": [
            "pathology",
            "chapter-02",
            "active-recall",
            "spaced-repetition"
          ]
        }
      ]
    },
    {
      "chapter_number": 3,
      "chapter_code": "03",
      "title": "Inflammation and Repair",
      "slug": "03-inflammation-and-repair",
      "status": "complete",
      "website": {
        "nav_label": "Chapter 3",
        "card_title": "Inflammation and Repair",
        "card_description": "Acute and chronic inflammation, mediator biology, systemic effects, wound healing, and fibrosis."
      },